Barry Lyndon,"An Irish rogue wins the heart of a rich widow and assumes her dead husband's aristocratic position in 18th-century England.In the eighteenth century, in a small village in Ireland, Redmond Barry (Ryan O'Neal) is a young farm boy in love with his cousin Nora Brady (Gay Hamilton). When Nora gets engaged to British Captain John Quin (Leonard Rossiter), Barry challenges him to a duel of pistols. He wins and escapes to Dublin, but is robbed on the road. Without an alternative, Barry joins the British Army to fight in the Seven Years War. He deserts and is forced to join the Prussian Army, where he saves the life of his Captain and becomes his protégé and spy of Irish gambler Chevalier de Balibari (Patrick Magee). He helps Chevalier and becomes his associate until he decides to marry the wealthy Lady Lyndon (Marisa Berenson). They move to England and Barry, in his obsession of nobility, dissipates her fortune and makes a dangerous and revengeful enemy.—Claudio Carvalho, Rio de Janeiro, BrazilThe rise and fall of the adult life of Irishman Redmond Barry (Ryan O'Neal), who, in his later life, would be known as Barry Lyndon, from the mid to late eighteenth century, is presented. Growing up in humble means, largely due to the early death of his aspiring lawyer father, the potential family breadwinner, Barry strives to live up to the standards of being a gentleman in every respect of the word, including monetarily. He leads a disjointed early adult life in trying to find his way, sometimes being unfairly given some hard knocks as the ways of the world work around him. He seems to find his stride in falling in love with wealthy and married Lady Lyndon (Marisa Berenson), who he ends up marrying following the death of her elderly first husband, Sir Charles Lyndon (Frank Middlemass). In taking over the affairs of the Lyndon mansion, Barry is able to live a means of his liking, all off the Lyndon's now quickly dwindling wealth due to Barry's squandering. As Barry is without money of his own, Mrs. Barry (Marie Kean) encourages her son to work toward a peerage as a means to have money of his own, as she fears that if Lady Lyndon were to die, she would leave all of what would remain of the Lyndon wealth to her son, Barry's stepson, Lord Bullingdon (Leon Vitali), with whom Barry has always had an antagonistic relationship to the point of Lord Bullingdon wanting revenge on the woes that his stepfather has created in their lives. Outwardly, Lord Bullingdon may seem to be the cause of Barry's fall, however, it may be more attributed to Barry being unable to adapt to any of the lives into which he is thrust to truly reach his goal of being a gentleman.—HuggoA gentlemanly rogue travels the battlefields and parlors of eighteenth century Europe determined to make for himself the life of a nobleman through seduction, gambling, and duelling in this methodical movie showing the rhythm and life of the period.—Keith Loh <loh@sfu.ca>Redmond Barry (Ryan O'Neal) is a young, roguish Irishman who's determined, in any way, to make a life for himself as a wealthy nobleman. Enlisting in the British Army, fighting in the Seven Years War in Europe, Barry deserts from the British Army, joins the Prussian Army, gets promoted to the rank of a spy, then becomes pupil to con artist and gambler Chevalier de Balibari (Patrick Magee). Barry then lies, dupes, duels, and seduces his way up the social ladder and enters into a lustful but loveless marriage to a wealthy countess named Lady Lyndon (Marisa Berenson), takes the name of ""Barry Lyndon"", settles in England with wealth and power beyond his wildest dreams, then slowly falls dramatically into ruin.—matt-282"
The Grand Budapest Hotel,"A writer encounters the owner of an aging high-class hotel, who tells him of his early years serving as a lobby boy in the hotel's glorious years under an exceptional concierge.This movie recounts the adventures of M. Gustave, a legendary concierge at a famous European hotel between the wars, and Zero Moustafa, the lobby boy who becomes his most trusted friend. The story involves the theft and recovery of a priceless Renaissance painting and the battle for an enormous family fortune - all against the backdrop of a suddenly and dramatically changing continent.—Fox Searchlight PicturesA teenage girl visits the monument of the writer who penned the book, ""The Grand Budapest Hotel"". In 1968, that author was inspired to write the book when he visited that hotel, located in the European mountainous country formerly known as Zubrowka. Once a luxurious hotel, it, in 1968, has fallen on hard times. The author meets the then current owner, Mr. Zero Moustafa, who recounts the story of how he became the hotel's owner and why he holds onto it and keeps it open despite it obviously making him no money. Zero's story begins in 1932, when the hotel was in its golden era. Zero was the novice immigrant lobby boy, who, like all the other hotel staff, was under the guidance of M. Gustave, the devoted concierge. Gustave aimed to please, he giving the guests whatever they wanted, especially the wealthy blonde women. The story largely revolves around one of those women, the wealthy Madame Céline Villeneuve Desgoffe-und-Taxis - better known as Madame D. - her opportunistic son Dmitri, the bequeathing of a valuable painting called ""Boy with Apple"" to Gustave, the mysterious circumstances surrounding her death which is initially pinned on Gustave, and the attempts of Zero, his girlfriend - a baker's assistant named Agatha - and others to clear Gustave's name while Dmitri does whatever he needs to get what he believes is rightfully his, namely the painting.—HuggoIn the far reaches of Eastern Europe in the former Republic of Zubrowka, there once was the Grand Budapest hotel. A writer remembers a stay at the hotel during the off season many years ago and recalls the tales he heard of the hotel's past from the elderly owner, Mr. Zero Moustafa. He tells the young writer about how he came to acquire the hotel and of the original concierge of the Grand Budapest, M. Gustave. Young Zero was a lobby boy at the time and accompanies Gustave to the reading of a will after one of their regular guests dies. She leaves Gustave a valuable painting, but when the woman's son challenges the will, Gustave and Moustafa steal the painting setting off a series of events that will lead to Moustafa's present circumstance.—garykmcdIn the 1930s, The Grand Budapest Hotel is a popular European ski resort, presided over by concierge M. Gustave. Zero Moustafa, a junior lobby boy, becomes Gustave's friend and protégé. Gustave prides himself on providing first-class service to the hotel's guests, including satisfying the needs of the many elderly women who stay there. When one of them dies mysteriously, Gustave finds himself the recipient of a priceless painting and the chief suspect in her murder.—Jwelch57421 moreAll"
Gone Girl,"With his wife's disappearance having become the focus of an intense media circus, a man sees the spotlight turned on him when it's suspected that he may not be innocent.On the occasion of his fifth wedding anniversary, Nick Dunne reports that his wife, Amy, has gone missing. Under pressure from the police and a growing media frenzy, Nick's portrait of a blissful union begins to crumble. Soon his lies, deceits and strange behavior have everyone asking the same dark question: Did Nick Dunne kill his wife?—Twentieth Century FoxNick Dunne, a small town guy who made good in the big city as a magazine writer blames the recession and the loss of his job for the decline of his marriage to his intellectually superior wife with a substantial trust fund. Questions of his motives and character begin to arise after his wife's disappearance on the morning of their fifth anniversary. As the search for his missing wife plays out over the ensuing days, guilty suspicions are fueled into a national frenzy by the media circus camped outside his house. Is this idyllic, everyman truly capable of murdering his wife?—MalcolmJTaylorNick and Amy Dunne are a couple living in a small town in Missouri. Nick calls the authorities when she goes missing but something is off about his behavior. Is he hiding something? Is he sad or distraught enough? While the police continue their investigation, Nick is battling a media frenzy and the people who believe his innocence is dwindling by the minute.—Angela ThomasA Missouri couple had a great life in their house with no kid, but it all changed when their 5th wedding anniversary occurs. Nick, the husband now realizes that his wife, Amy has gone missing. He calls the local authorities for reporting the situation. Along with the time and the local searching program, the progress becoming blurred between Nick's version of the story or the new investigation result - that Nick suspected of killing his wife. Now, Nick struggles for convincing the media, telling them if he didn't kill his wife, and probe the cryptic clues from his own wife.—Gusde2 moreAll"
Hacksaw Ridge,"World War II American Army Medic Desmond T. Doss, serving during the Battle of Okinawa, refuses to kill people and becomes the first man in American history to receive the Medal of Honor without firing a shot.The true story of Desmond T. Doss, the conscientious objector who, after the Battle of Okinawa, was awarded the Medal of Honor for his incredible bravery and regard for his fellow soldiers. Following his upbringing and how this shaped his views (especially his religious view and anti-killing stance), Doss's trials and tribulations after enlisting in the US Army (trying to become a medic) begin, preluding the hell on Earth that was Hacksaw Ridge.—grantssAfter Desmond T. Doss voluntarily enlists in the US Army to perform as a medic in WWII, he is presumed a coward for his anti-killing stance and nearly discharged for it. His incredibly brave true story actions on Hacksaw Ridge at the Battle of Okinawa, however, wins the surprised deep respect of his fellow soldiers.—Shine LightThe extraordinary true story of conscientious objector Desmond T. Doss, who saved seventy-five men in Okinawa during the bloodiest battle of WWII without firing a single shot. Believing that the war was just but killing was nevertheless wrong, he was the only American soldier in WWII to fight on the front lines without a weapon. As an army medic, Doss single-handedly evacuated the wounded near enemy lines - braving enemy fire and putting his own life on the line. He was the first conscientious objector to ever earn the Congressional Medal of Honor.—Jwelch5742The true story of Pfc. Desmond T. Doss, who won the Congressional Medal of Honor despite refusing to bear arms on religious grounds during WWII. Ostracized by fellow soldiers for his pacifist stance, Doss went on to earn respect and adoration for his bravery, selflessness and compassion after risking his life, without firing a shot, to save seventy-five men in the Battle of Okinawa.1 moreAll"
The Gold Rush,"A prospector goes to the Klondike during the 1890s gold rush in hopes of making his fortune, and is smitten with a girl he sees in a dance hall.A lone prospector ventures into Alaska looking for gold. He gets mixed up with some burly characters and falls in love with the beautiful Georgia. He tries to win her heart with his singular charm.—John J. Magee <magee@helix.mgh.harvard.edu>The Little Tramp goes prospecting for gold in the Klondike. Conditions are harsh, there is little in the way of comfort or food and even less it seems in the way of gold. Thanksgiving dinner for himself and Big Jim Mckay consists of a boiled boot. Once in town, he meets the beautiful Georgia at the Monte Carlo dance hall. He finds himself in competition with the ladies man who has his eyes on Georgia as well. Meanwhile, Black Larsen - wanted by the police - tries to steal Big Jim McKay's claim. Big Jim tries to stop him but knocked unconscious, he loses his memory. Back in town, the little tramp tries to impress Georgia. When Big Jim arrives, he regains his memory and he and the Little Tramp set off to make their fortune. Sailing home as rich men, the Little Tramp has one more chance to unite with Georgia.—garykmcdDuring the Gold Rush, prospectors hoping to find fortune travel to Chilkoot Pass, a high mountain of harsh and dangerous conditions. Big Jim, a gold prospector has just discovered a massive stash of gold on his patch of land. When a blizzard strikes, and A Lone Prospector gets lost in the same storm, the two must fight for the territory. As they encounter one adventure after another, The Lone Prospector is lead to and eventually meets the love of his life.—Kyle Perez"
Salinui chueok,"In a small Korean province in 1986, two detectives struggle with the case of multiple young women being found raped and murdered by an unknown culprit.1986. In a rural district of South Korea, two women have been recently raped and murdered. Working on the case are detectives Park Doo-man and Cho Yong-koo. Their efforts are impeded by some sloppy crime scene procedure by the police. Their methods of solving cases are also quite basic, essentially amounting to beating confessions out of suspects. All this leads to nothing and the police chief brings in a more sophisticated and intelligent detective from Seoul, Seo Tae-yoon. With his arrival the methods improve but they still don't have the killer. Then another woman is found murdered and a pattern emerges.—grantssAfter the discovery of two dead bodies in a small village, a detective n his partner decides to question a mentally handicapped young man because the man used to follow one of the victims around town but their forced confessions and interrogation techniques are questioned when a detective from a city volunteers to assist them.—Fella_shibby@yahoo.comAn unprecedented spate of brutal homicides shakes a once-peaceful, close-knit community in 1986 South Korea. As tortured, sexually assaulted bodies keep emerging, the Seoul hotshot detective, Seo Tae-yoon, volunteers to lend a hand, eager to get to the bottom of the knotty case with the help of the baffled local officers, Park Doo-man and Cho Yong-koo. However, as hope turns into despair, their efforts remain fruitless. Is this the work of the same man--an unstoppable homicidal maniac?—Nick Riganas"
In the Name of the Father,"An Irish man's coerced confession to an I.R.A. bombing he did not commit results in the imprisonment of his father as well. Meanwhile, a British lawyer fights to clear their names and free them.Young Belfastian Gerry Conlon (Daniel Day-Lewis) admits that he was in London at the time of the incident. He also admits that he is not a model citizen, having committed a petty robbery while in London. He does however profess his innocence when it comes to the bombing of the Guildford Pub in London in 1974, the event which killed several people inside. A self-professed non-political person, he and his three co-accused, dubbed the Guildford Four, are thought to be provisional members of the I.R.A. Their self-professed innocence is despite each having signed a statement of guilt which they claim were signed under duress. Their case includes having provable alibis for the time frame of the bombing. And eventually, Joe McAndrew (Don Baker), a known I.R.A. member, admits to the bombing. Dubbed the Maguire Seven, seven others, primarily members of Gerry's extended family including his father Giuseppe (Pete Postlethwaite), are accused of being accessories to the bombing. Following on the work initiated by Giuseppe, Gerry works on a campaign to prove their collective innocence, this work with the assistance of compassionate lawyer Gareth Peirce (Dame Emma Thompson). As Gareth works on this campaign, she is faced with obstacle after obstacle placed by Robert Dixon (Corin Redgrave), who led the initial investigation and questioning of the four accused on behalf of the Police.—HuggoUnemployed young Irishman Gerry Conlon (Daniel Day-Lewis) gets by as a petty thief in 1970s Belfast. When local IRA leaders get fed up with him, he flees to England and meets up with his friend Paul Hill (John Lynch). On the same night that the IRA bombs a nearby pub, the friends get kicked out of their communal digs and are forced to sleep in a park. He returns to Belfast, but is arrested as the prime suspect in the bombing and imprisoned, where he spends 15 years trying to clear his name.—FilmsNowBased on the true story of Gerry Conlon (Daniel Day-Lewis), a Belfast youth who - along with family members and friends - was wrongly convicted of bombing two pubs outside of London. A story about the relationship between a father and his son who fought for justice to clear his father's name.—Harald Mayr <marvin@bike.augusta.de>"
Dead Poets Society,"Maverick teacher John Keating returns in 1959 to the prestigious New England boys' boarding school where he was once a star student, using poetry to embolden his pupils to new heights of self-expression.Painfully shy Todd Anderson has been sent to the school where his popular older brother was valedictorian. His roommate, Neil Perry, although exceedingly bright and popular, is very much under the thumb of his overbearing father. The two, along with their other friends, meet Professor Keating, their new English teacher, who tells them of the Dead Poets Society, and encourages them to go against the status quo. Each does so in his own way, and is changed for life.—Liz Jordan <c9310494@alinga.newcastle.edu.au>A new English teacher, John Keating, is introduced to an all-boys preparatory school that is known for its ancient traditions and high standards. He uses unorthodox methods to reach out to his students, who face enormous pressures from their parents and the school. With Keating's help, students Neil Perry, Todd Anderson and others learn to break out of their shells, pursue their dreams and seize the day.—Jwelch5742Vermont, New England, 1959. The students at Welton Academy have been trained for generations to lead lives of conformity and tradition--until charismatic new professor John Keating sets foot in the institution, motivating them to think for themselves, live life to the fullest, and ""Carpe Diem"". As a result of his unconventional approach, inspirational Keating awakens the students' spirits, encourages them to be exceptional individuals, and challenges them to achieve their full potential. However, when tragedy strikes the school, drawing the wrath of a disapproving faculty, Keating and his boys will find themselves at loggerheads with the school's officials, the parents, and the system.—Nick Riganas"
Mad Max: Fury Road,"In a post-apocalyptic wasteland, a woman rebels against a tyrannical ruler in search for her homeland with the aid of a group of female prisoners, a psychotic worshiper and a drifter named Max.An apocalyptic story set in the furthest reaches of our planet, in a stark desert landscape where humanity is broken, and almost everyone is crazed fighting for the necessities of life. Within this world exist two rebels on the run who just might be able to restore order. There's Max, a man of action and a man of few words, who seeks peace of mind following the loss of his wife and child in the aftermath of the chaos. And Furiosa, a woman of action and a woman who believes her path to survival may be achieved if she can make it across the desert back to her childhood homeland.—ProductionIn the stark desert wasteland populated by a broken humanity driven with survival and the unending ravage for gasoline, a loner named Max finds himself unwantedly caught in the middle of a chase while aiding the heroine Furiosa and her female companions. She struggles to return to her homeland and escape the clutches of a ruthless desert gang leader, Immortal Joe. With the harsh desert sands in front of them and marauders behind, only the maddest will prevail the storm.Years after the collapse of civilization, the tyrannical Immortal Joe enslaves apocalypse survivors inside the desert fortress the Citadel. When the warrior Imperator Furiosa leads the despot's five wives in a daring escape, she forges an alliance with Max Rockatansky, a loner and former captive. Fortified in the massive, armored truck the War Rig, they try to outrun the ruthless warlord and his henchmen in a deadly high-speed chase through the Wasteland.—Jwelch5742Trapped in the barren deserts of the dystopian Wasteland, lone road warrior Max Rockatansky struggles to stay one step ahead of the water-controlling overlord Immortan Joe and the Wild Boys, his loyal gang of marauders. But life in the carcass of civilisation is cheap. And to further complicate matters, Max then crosses paths with fearless Imperator Furiosa: one of Joe's elite lieutenants and a traitor--she has just fled the Citadel in her heavily armoured truck, The War Rig, absconding with an irreplaceable quintet of wives. Now, there is no turning back. As the powerful tyrant and his unstoppable horde of delusional zealots hunt them down with murderous intent, Max and Furiosa will need all the help they can get to stay alive. However, do they have what it takes to cheat death and live to tell the tale?—Nick Riganas"
Relatos salvajes,"Six short stories that explore the extremities of human behavior involving people in distress.The film is divided into six segments. (1) ""Pasternak"": While being on a plane, a model and a music critic realise they have a common acquaintance called Pasternak. Soon they discover that every passenger and crew member on board know Pasternak. Is this coincidence? (2) ""The Rats"": A waitress recognizes her client - it's the loan shark who caused a tragedy in her family. The cook suggests mixing rat poison with his food, but the waitress refuses. The stubborn cook, however, decides to proceed with her plan. (3) ""The Strongest"": Two drivers on a lone highway have an argument with tragic consequences. (4) ""Little Bomb"": A demolition engineer has his car towed by a truck for parking in a wrong place and he has an argument with the employee of the towing company. This event destroys his private and professional life, and he plots revenge against the corrupt towing company and the city hall. (5) ""The Proposal"": A reckless son of a wealthy family has an overnight hit-and-run accident, in which a pregnant woman gets killed. He wakes his parents up and his father calls the lawyer. The parents propose to pay the groundkeeper to take the blame for the boy. Soon the father discovers that he is a victim of extortion of his lawyer and the public prosecutor in charge of the investigation. What will be his decision? (6) ""Until Death Do Us Apart"": During the wedding party, the bride discovers that her newlywed husband has been cheating on her with one of the guests, and she decides to pay him back.—Claudio Carvalho, Rio de Janeiro, BrazilComposed of six short segments dealing with revenge and violence, ""Wild Tales"" pivots around the universal theme of retribution and the complications of seeking catharsis through vengeance. Starting with ""Pasternak"", an attractive young model, while aboard a plane, strikes up a conversation with another passenger about a guy named Pasternak, only to realise that they're not the only ones who know him. Who is the man locked in the cockpit? In ""The Rats"", a young waitress comes face-to-face with her painful past and agonising moral dilemmas. Is revenge a dish best served cold? Then, in ""The Strongest"", a remote highway in the desert becomes the macabre backdrop for two drivers. Who will prevail? In ""Little Bomb"", a parking violation sets in motion a series of unfortunate events, as a demolition engineer's whole world comes crashing down around him. Will he put his skills to good use? In ""The Proposal"", the affluent parents of a teenage driver who has committed a horrible hit-and-run accident devise a plan to get him off the hook. But, can money buy everything? Lastly, in ""Till Death Do Us Part"", a blissful bride discovers that her groom has cheated on her. Will she turn the tables on him?—Nick RiganasSix separate stories, whose characters find themselves facing a reality that shifts and suddenly turns unpredictable, and crossing the divide between civilization and barbarism. A lover's betrayal, a return to the repressed past and the violence woven into everyday encounters drive the characters to madness as they lose control."
