Witness for the Prosecution,"A veteran British barrister must defend his client in a murder trial that has surprise after surprise.Ailing barrister Sir Wilfrid Robarts is thrust back into the courtroom in what becomes one of the most unusual and eventful murder cases of the lawyer's career when he finds himself defending Leonard Vole, a man being tried for the murder of a wealthy woman. With Robarts choosing to represent him, the two find themselves up against Leonard's cold-hearted wife, Christine - who, in a surprising turn of events, chooses to appear in court against her husband.—Kyle PerezWhen Leonard Vole is arrested for the sensational murder of a rich, middle-aged widow, the famous Sir Wilfrid Robarts agrees to appear on his behalf. Sir Wilfrid, recovering from a near-fatal heart attack, is *supposed* to be on a diet of bland, civil suits. But the lure of the criminal courts is too much for him, especially when the case is so difficult: Vole's only alibi witness is his wife, the calm and coldly calculating Christine Vole. Sir Wilfrid's task becomes even more impossible when Christine agrees to be a witness not for the defence but for the prosecution.—A.L.Beneteau <albl@inforamp.net>Leonard Vole is an unemployed inventor, his latest contraption being a new-fangled egg beater. He is married but through a chance encounter, became friendly with a rich widow, Emily French. When Vole is accused of her murder, his solicitor refers the case to a brilliant barrister, Sir Wilfrid Robarts to lead the defense. Robarts believes his client to be innocent but his alibi rests on the testimony of Vole's wife, Christine. As the jury would expect a wife to defend her husband, he decides not to call her as a witness. He is surprised however when she is called as a witness for the prosecution. As luck would have it, he comes into possession of letters that seriously discredits her testimony. There is, however, a far more devious plot being hatched, one that even the great Robarts cannot fathom.—garykmcd"
The Shining,"A family heads to an isolated hotel for the winter where a sinister presence influences the father into violence, while his psychic son sees horrific forebodings from both past and future.After landing a job as an off-season caretaker, Jack Torrance, an aspiring author and recovering alcoholic, drags his wife Wendy and gifted son Danny to snow-covered Colorado's secluded Overlook Hotel. But writer's block prevents Jack from pursuing a new writing career. Everything has its time, however. First, the manager must give Jack a grand tour. Then, Mr Hallorann, the facility's ageing chef, chats with Danny about rare psychic gifts. The mysterious employee also warns the boy about the cavernous hotel's abandoned rooms. Room 237, especially, is off-limits. That's all very well, but Jack is gradually losing his mind. After all, strange occurrences and blood-chilling visions have trapped the family in a silent gargantuan prison hammered by endless snowstorms. And now, incessant voices inside Jack's head demand sacrifice. However, is Jack capable of murder?—Nick RiganasBuilt in 1907, the posh, grand and secluded Overlook Hotel, located in the mountains of Colorado, closes for the winter months as it was never designed as a ski resort, that seclusion and isolation which has always been its attraction for its upscale guests and which makes it largely inaccessible in the snowy winter. Having recently moved from Vermont to Boulder with his wife Wendy and their adolescent son Danny, former schoolteacher Jack Torrance has just accepted the five month job as the Overlook's winter caretaker in wanting uninterrupted solitude to start his new career as a writer. In accepting the job, Jack was not deterred in knowing of the incident ten years ago when the then hotel GM Charles Grady, acting as that season's winter caretaker, developed a severe case of cabin fever and ended up gruesomely killing his wife and two daughters before killing himself. Beyond a recent undiagnosed collapse experienced by Danny which may be an issue if it happens again at the hotel, Wendy is looking forward to this five month getaway. While Danny indirectly states he doesn't want to go, Wendy is not concerned about his emotional well being in this new situation as he, out of circumstance, has often been on his own without other children around, which has long ago led to him creating an imaginary friend named Tony who lives in Danny's mouth. When the Torrances arrive at the Overlook on October 30th, its last day of operation before they take over for the winter, Danny learns that there is someone at the hotel who knows his secret abilities in association to Tony's true nature. After the regular staff leaves for the winter and as winter truly sets in, the isolation of the resort begins to show itself. The question becomes which of the often battling powers in this isolation will ultimately come out on top: Wendy's mortal fortitude, Danny's secret ability which he learns is called the shining, or the hotel's associated secrets which are slowly overtaking Jack.—HuggoA novelist - Jack Torrance takes a job interview as winter caretaker of the isolated, old, huge and beautiful Overlook Hotel. Jack brings his wife - Wendy and his son Danny. It happens that Danny, has a mysterious power known as ""The Shining"". Danny meets Hallorann - the hotel cook in their first day arriving at the Overlook, who warns him about the hotel and the sinister Room 237. As the days go by, Danny has visions, meanwhile Jack starts driving into insanity, turning more and more aggressive, at the point that Danny and Wendy gets convinced that Jack might try to do something bad.—Film Geek Guy"
The Great Dictator,"Dictator Adenoid Hynkel tries to expand his empire while a poor Jewish barber tries to avoid persecution from Hynkel's regime.20 years after the end of WWI, in which the nation of Tomainia was on the losing side, Adenoid Hynkel has risen to power as the ruthless dictator of the country. He believes in a pure Aryan state and the decimation of the Jews. This situation is unknown to a simple Jewish Tomainian barber who has been hospitalized since a WWI battle. Upon his release the barber, who had been suffering from memory loss about the war, is shown the new persecuted life of the Jews by many living in the Jewish ghetto, including a washerwoman named Hannah with whom he begins a relationship. The barber is ultimately spared such persecution by Commander Schultz, whom he saved in that WWI battle. The lives of all Jews in Tomainia are eventually spared with a policy shift by Hynkel himself, who is doing so for ulterior motives. But those motives include a desire for world domination, starting with the invasion of neighboring Osterlich, which may be threatened by Benzino Napaloni, the dictator of neighboring Bacteria. Ultimately Schultz, who has turned traitor against Hynkel's regime, and the barber may be able to join forces to take control of the situation, using Schultz's inside knowledge of the regime's workings and the barber's uncanny resemblance to one of those in power.—HuggoAfter dedicated service in the Great War, a Jewish barber (Chaplin) spends years in an army hospital recovering from his wounds, unaware of the simultaneous rise of fascist dictator Adenoid Hynkel (also Chaplin) and his anti-Semitic policies. When the barber, who bears a remarkable resemblance to Hynkel, returns to his quiet neighbourhood, he is stunned by the brutal changes and recklessly joins a beautiful girl (Goddard) and her neighbours in rebelling.During the last days of the First World War, a clumsy soldier saves the life of devoted military pilot Schultz. Unfortunately, their flight from the advancing enemy ends in a severe crash with the clumsy soldier losing his memory. After many years in the hospital, the amnesia patient gets released and reopens his old barber shop in the Jewish ghetto. But times have changed in the country of Tomania: Dictator Adenoid Hynkel, who accidentally looks very similar to the barber, has imposed his merciless grip on the country, and Jewish people are discriminated against. One day the barber gets in trouble and is brought before a commanding officer, who turns out to be his old comrade Schultz. The ghetto enjoys protection from then on. Meanwhile, Dictator Hynkel develops big plans: he wants to become Dictator of the whole world and needs a scapegoat for the public. Soon Schultz is being arrested for being too Jewish-friendly, and all Jews except those who managed to flee are transported into Concentration Camps. Hynkel is planning to march into Osterlich to show off against Napaloni, Dictator of Bacteria, who has already deployed his troops along the small country's other border. Meanwhile, Schultz and the barber manage to escape, disguised in military uniforms. Luckily, Schultz and the barber are picked up by Tomanian forces and the barber is mixed up with Hynkel himself. The small barber now gets the once-in-a-lifetime chance to speak to the people of Osterlich and all of Tomania, who listen eagerly on the radio.—Julian Reischl <julianreischl@mac.com>"
Aliens,"Decades after surviving the Nostromo incident, Ellen Ripley is sent out to re-establish contact with a terraforming colony but finds herself battling the Alien Queen and her offspring.57 years after Ellen Ripley had a close encounter with the reptilian alien creature from the first movie, she is called back, this time, to help a group of highly trained colonial marines fight off against the sinister extraterrestrials. But this time, the aliens have taken over a space colony on the moon LV-426. When the colonial marines are called upon to search the deserted space colony, they later find out that they are up against more than what they bargained for. Using specially modified machine guns and enough firepower, it's either fight or die as the space marines battle against the aliens. As the Marines do their best to defend themselves, Ripley must attempt to protect a young girl who is the sole survivor of the nearly wiped out space colony.—blazesnakes9Living in a state of suspended animation for the past fifty-seven years, the sole survivor of the bloody Nostromo massacre in Alien (1979), Lieutenant First Class Ellen Ripley, wakes up in a salvage ship on its way back to Earth. Now, faced with the consequences of her actions, disgraced Ripley reluctantly accepts to escort the junior executive, Carter Burke, along with a tough-as-nails squad of U.S. Colonial Marines to Hadley's Hope, the terraforming and mining colony on LV-426, in exchange for her pilot's licence. But, there, on the dark surface of the remote exoplanetary satellite, multitudes of predatory endoparasitoid creatures known as Xenomorphs, just like the aggressive Stage 3 drone that killed Ellen's companions, prowl the area. This time, it's war, and as the undaunted, acid-spewing space-insects decimate the armed-to-the-teeth troops, once more, Ripley must take her life into her own hands. Can a woman alone put an end to the nightmare of the ferocious Aliens?—Nick RiganasIn James Cameron's superb sequel to Alien (1979), Sigourney Weaver returns to civilization and is recruited to rescue a space colony on the planet where the first alien reigned. Only one small girl has survived--but a whole nest of 'them' is waiting for new prey. Hellbent on saving the child, Weaver takes on the alien leader, a female protecting her young, in a fight to the death.Fifty-seven years after surviving an apocalyptic attack aboard her space vessel by merciless space creatures, Officer Ripley (Sigourney Weaver) awakens from hyper-sleep and tries to warn anyone who will listen about the predators. Although she is ignored at first, when contact with colonists on a planet thought safe is suddenly lost, Ripley and a military team are sent to confront the aliens.1 moreAll"
Inglourious Basterds,"In Nazi-occupied France during World War II, a plan to assassinate Nazi leaders by a group of Jewish U.S. soldiers coincides with a theatre owner's vengeful plans for the same.In German-occupied France, young Jewish refugee Shosanna Dreyfus witnesses the slaughter of her family by Colonel Hans Landa. Narrowly escaping with her life, she plots her revenge several years later when German war hero Fredrick Zoller takes a rapid interest in her and arranges an illustrious movie premiere at the theater she now runs. With the promise of every major Nazi officer in attendance, the event catches the attention of the ""Basterds"", a group of Jewish-American guerrilla soldiers led by the ruthless Lt. Aldo Raine. As the relentless executioners advance and the conspiring young girl's plans are set in motion, their paths will cross for a fateful evening that will shake the very annals of history.—The Massie TwinsIt's WWII, the battleground, Nazi-occupied France. The Nazis are doing whatever they need to to flush out and exterminate Jews, the most proficient and prolific of the Jew hunters being the sadistic SS Colonel Hans Landa. As such, the American military forms a unit, led by Lieutenant Aldo Raine and comprised of eight Jews, to kill as many Nazis as possible. Raine requests each of his men to bring him the scalp of at least 100 Nazis apiece. He has his own method of ensuring that those Nazis he does allow or need to let go free are scarred for life. In Paris in 1944, Joseph Goebbels, the Nazi's chief propaganda master and filmmaker, plans to debut his latest film, ""Nation's Pride"". The film, based on the victorious military exploits of Private Fredrick Zoller, stars Zoller as himself. Because of his attraction to its pretty proprietress Emmanuelle Mimieux, Zoller convinces Goebbels and the Nazi brass to hold the premiere at Mimieux's cinema. Landa is to act as chief of security for the event. When the Americans get wind of the screening and the fact that most of the Nazi highers-up will be in attendance, Raine's team is tasked with blowing up the cinema during the screening. They are assisted by renowned German actress, Bridget von Hammersmark, who has been working as a spy for the British. They believe luck is on their side when they learn that Hitler himself is scheduled to attend. Beyond being found out, Raine's team face two as of yet unknown issues. The first is Mimieux, who is really Shoshanna Dreyfus, a Jew who saw her family brutally murdered by Landa four years earlier, and who may have her own plans for Landa and the Nazis. The second is Landa, who beyond his up front mission, has another more personal mission for his life post-war unknown to anyone but himself.—Huggo1941, Nazi-occupied France. After witnessing the brutal massacre of her family at the hands of evil SS officer Colonel Hans Landa, young Jewish refugee Shosanna Dreyfus swears revenge. Three years later, Fredrick Zoller, a feared German sniper and protagonist in a Joseph Goebbels propaganda film, takes a shine to Shosanna, who now operates a cinema in Paris. But with the film's premiere rumoured to catch the attention of Adolf Hitler himself, Lieutenant Aldo Raine's Basterds--a Jewish-American suicide squad ridding France of Nazis--are determined to seize the golden opportunity to crash their party. And soon, the memory of a blood-stained past paired with the prospect of a brighter future will give birth to the ultimate payback. But who shall live, and who shall die in the private screening of death?—Nick RiganasNazi-occupied France, June 1944. Lt. Aldo Raine leads a squad of crack Jewish US Army soldiers, the Bastards, deep behind enemy lines. Their job: killing Germans, as many as possible. Meanwhile Nazi propaganda minister Joseph Goebbels is about to premier his latest propaganda film at a cinema in Paris. All the high-ranking Nazis will be there, making it a perfect target for the Bastards. Meanwhile, the manageress of the cinema, a Jew whose entire family was wiped out by the Nazis, has similar plans.—grantss1 moreAll"
The Dark Knight Rises,"Eight years after the Joker's reign of chaos, Batman is coerced out of exile with the assistance of the mysterious Selina Kyle in order to defend Gotham City from the vicious guerrilla terrorist Bane.Despite his tarnished reputation after the events of The Dark Knight (2008), in which he took the rap for Dent's crimes, Batman feels compelled to intervene to assist the city and its Police force, which is struggling to cope with Bane's plans to destroy the city.—WellardRockardEight years after the events of The Dark Knight (2008) find Gotham at a time of peace. This is due to Batman taking the fall for Harvey Dent's murder. However, a new evil force named Bane has arrived in Gotham and aims to take over the city and expose the truth behind who Harvey Dent really was. Now that Wayne Manor has been completely rebuilt, Bruce Wayne has become almost reclusive, rarely leaving the estate. And with Bane taking over the city by force, it forces Batman to come out of retirement. But his allies are few and far between. An elusive jewel thief by the name of Selina Kyle could be the key to stopping Bane, but whose side is she on?—halo1kBatman is forced out of eight years of hiding when a ruthless mercenary called Bane takes control of Gotham's underworld, and makes plans to take over the whole city. With the help of the mysterious Selina Kyle and his butler Alfred, Bruce must protect the citizens of the beloved from their greatest threat yet.—ahmetkozanFrom a far side of the world, a lunatic rises from the darkness, determined to annihilate the city of the Dark Knight, who has been hiding for eight years. Joining forces with old and new allies, Bruce Wayne must put his mask on one last time to finish what he had started and become a hero again.—DanEdge1 moreAll"
Dr. Strangelove or: How I Learned to Stop Worrying and Love the Bomb,"An unhinged American general orders a bombing attack on the Soviet Union, triggering a path to nuclear holocaust that a war room full of politicians and generals frantically tries to stop.Paranoid Brigadier General Jack D. Ripper of Burpelson Air Force Base, believing that fluoridation of the American water supply is a Soviet plot to poison the U.S. populace, is able to deploy through a back door mechanism a nuclear attack on the Soviet Union without the knowledge of his superiors, including the Chair of the Joint Chiefs of Staff, General Buck Turgidson, and President Merkin Muffley. Only Ripper knows the code to recall the B-52 bombers and he has shut down communication in and out of Burpelson as a measure to protect this attack. Ripper's executive officer, RAF Group Captain Lionel Mandrake (on exchange from Britain), who is being held at Burpelson by Ripper, believes he knows the recall codes if he can only get a message to the outside world. Meanwhile at the Pentagon War Room, key persons including Muffley, Turgidson and nuclear scientist and adviser, a former Nazi named Dr. Strangelove, are discussing measures to stop the attack or mitigate its blow-up into an all out nuclear war with the Soviets. Against Turgidson's wishes, Muffley brings Soviet Ambassador Alexi de Sadesky into the War Room, and get his boss, Soviet Premier Dimitri Kisov, on the hot line to inform him of what's going on. The Americans in the War Room are dismayed to learn that the Soviets have an as yet unannounced Doomsday Device to detonate if any of their key targets are hit. As Ripper, Mandrake and those in the War Room try and work the situation to their end goal, Major T.J. ""King"" Kong, one of the B-52 bomber pilots, is working on his own agenda of deploying his bomb where ever he can on enemy soil if he can't make it to his intended target.—HuggoA fundamental pedantic General, evokes a huge number of optimists (politicians) to prevent his actions, by practically quarrelling with the outcome of the salted bomb that was being prepared to be dropped on the soviets, that could cause a radio active encirclement of 90 years loitering.U.S. Air Force General Jack Ripper goes completely and utterly mad, and sends his bomber wing to destroy the U.S.S.R. He suspects that the communists are conspiring to pollute the ""precious bodily fluids"" of the American people. The U.S. president meets with his advisors, where the Soviet ambassador tells him that if the U.S.S.R. is hit by nuclear weapons, it will trigger a ""Doomsday Machine"" which will destroy all plant and animal life on Earth. Peter Sellers portrays the three men who might avert this tragedy: British Group Captain Lionel Mandrake, the only person with access to the demented Gen. Ripper; U.S. President Merkin Muffley, whose best attempts to divert disaster depend on placating a drunken Soviet Premier and the former Nazi genius Dr. Strangelove, who concludes that ""such a device would not be a practical deterrent for reasons which at this moment must be all too obvious"". Will the bombers be stopped in time, or will General Jack Ripper succeed in destroying the world ?—Colin Tinto <cst@imdb.com>U.S. President Merkin Muffley is on the hot line to Moscow with some rather embarrassing news for the Soviet premier: ""Hello, Dimitri....I'm fine....Now then, you know how we've always talked about the possibility of something going wrong with the bomb....The bomb, Dimitri. The hydrogen bomb....Well, now, what happened is that, uh, one of our base commanders...he went a little funny in the head....and he went and did a silly thing....He ordered his planes to attack your country."" A comedy about an accidental nuclear attack? One that ends with total annihilation, thermonuclear apocalypse? Preposterous! Stanley Kubrick thought otherwise. In the end his thinking prevailed. The mad saga revolves around a psychotic Strategic Air Command officer, Gen. Jack D. Ripper, who lets loose his B-52 bomber squadron on the Soviet Union. Ripper takes this unilateral action because of his paranoid belief that Communists are sapping and contaminating ""all our precious bodily fluids"" as part of their plan to take over the world. Unbeknownst to Ripper, his attack will trigger the Russian's ultimate weapon, the Doomsday Machine, a diabolical retaliatory device set to blow up the planet.—alfiehitchie"
