Dangal,"Former wrestler Mahavir Singh Phogat and his two wrestler daughters struggle towards glory at the Commonwealth Games in the face of societal oppression.Biopic of Mahavir Singh Phogat, who taught wrestling to his daughters Babita Kumari and Geeta Phogat. Geeta Phogat was India's first female wrestler to win at the 2010 Commonwealth Games, where she won the gold medal (55 kg) while her sister Babita Kumari won the silver (51 kg).—Dibyayan_ChakravortyDangal is a biography of a real life patriotic fighter Mahavir Singh Phogat who raises his daughters and evolves them into World Class Fighters. The movie begins with a crochy brawl between Mahavir (Aamir Khan) and his colleague who was also former wrestler, thus embalming the terrific Dangal Theme, discovering Mahavir's past life of a Wrestler. Mahavir admires to make his dreams come true by his sons but on contrary, four daughters take birth. They come with a complaint of beating down a boy in their locality. Hence Mahavir hopes they would be future Wrestlers. So he trains his daughters Gita and Babita, thus proving they're no less than a professional male wrestler. After a long struggle, Gita enters the National level Wrestling and acquires victory. When she is up to the Internationals, she opts to get trained from the NSA(National Sports Academy) where a coach mis-trains Gita, due to which she deliberately fails every match she attempts. Her sister Babita also attains an age to get into Wresting. Now, Mahavir plans to train both by his own norms. Finally, Gita defeats an Australian Wrestler by following the predominant path of her father, not of the coach. The movie is par excellent, enridges Women Empowerment in the Nation.—Srivathsavan IyengarMahavir Singh Phogat is a former wrestling champion had to quit the sport due to his family pressure as it was not helping his family financially.He only dreams that his son should win Gold Medal for India in wrestling but back to back he has four daughter's.Mahavir feels his dream cant be complete and starts staying away from the sport,while his daughter Geeta and Babita are growing the notices that they have quality of being wrestlers and starts training them,Geeta and Babita have to get a hard training and start to dislike their father for this but they realize that their father is doing this for their betterment and take the sport seriously. Geeta soon becomes a a known wrestler in the state and wins Junior International.Geeta further has to Patiala for further training to participate in common wealth games where she has a new coach Pramod Kadam.Meanwhile Babita makes her name at Junior level.Geeta believes her coach's training is better than her father which makes Mahavir very depressed.—alex.mjacko@gmail.com"
Per qualche dollaro in più,"Two bounty hunters with the same intentions team up to track down a gang of outlaws led by a psychotic Mexican bandit, who is plotting an audacious bank robbery.With his reputation preceding him after a white-knuckle duel eighteen months ago, a taciturn American bounty hunter rides into the godforsaken town of Tucumcari. After all, nothing can stop him--this time, the solitary stranger is after El Indio, a psychopathic bandit leader bent on destruction and mayhem. But the sadistic outlaw and his murderous jackals have already set their sights on robbing the impenetrable Bank of El Paso. As a result, the poncho-clad Americano has no choice but to break an unwritten personal rule: join forces with Colonel Douglas Mortimer, a hawk-eyed marksman with a hidden agenda. Now, two seasoned hunters, The Man with No Name and The Man in Black, are after the same prey. And as silent double-crosses and fragile allegiances pave the way for a bloody showdown at high noon, a question arises. Once, the nameless American risked life and limb for a fistful of dollars. Is it worth dicing with death for a few dollars more?—Nick Riganas"
Batman Begins,"After witnessing his parents' death, Bruce learns the art of fighting to confront injustice. When he returns to Gotham as Batman, he must stop a secret society that intends to destroy the city.When his parents are killed, billionaire playboy Bruce Wayne relocates to Asia, where he is mentored by Henri Ducard and Ra's Al Ghul in how to fight evil. When learning about the plan to wipe out evil in Gotham City by Ducard, Bruce prevents this plan from getting any further and heads back to his home. Back in his original surroundings, Bruce adopts the image of a bat to strike fear into the criminals and the corrupt as the icon known as ""Batman"". But it doesn't stay quiet for long.—konstantinweAs a child, a young Bruce Wayne witnesses the death of his parents at the hands of a crazed criminal. As an adult, Bruce travels the world seeking the means to fight injustice. He lives amongst the boroughs of criminals and thieves in central Asia. Eventually, he meets a mysterious figure named Ra's Al Guhl and joins his gang called the League of Shadows. Using his training, he is able to defeat his trainer. Finally meeting up with his estate caretaker Alfred Pennyworth, Bruce Wayne returns to Gotham. There, he becomes the new head of Wayne Enterprises. Together, with the help of the C.E.O. of the Wayne Enterprises Applied Sciences division, a man name Lucius Fox, he dons a new persona: Batman. As Batman takes on the criminals and organized crime underworld of Gotham, a sinister new underbelly of the city is exposed, and a new class of criminal is born. Will Batman be the one to stop them all, or does Gotham need a hero with a face?—halo1kBruce Wayne, who experiences the death of his parents at a very young age, relocates to Asia and trains with his mentors, Henri Ducard and Ra's Al Ghul in fighting injustice. He returns to a crime-ridden Gotham and with the help of his old butler and estate caretaker, Alfred, the C.E.O. of Wayne Enterprises Applied Science Division Lucius Fox, he dons a new persona, Batman, to strike fear into the hearts of the criminals and the corrupt. With the help of rising cop Gordon, and the Assistant District Attorney, and Bruce's love interest Rachel Dawes, he is able to take down the Mafia Don Falcone, and the twisted doctor/drug dealer Jonathan Crane a.k.a. The Scarecrow. With Ra's Al Ghul's return with his evil plan to destroy Gotham by inducing fear into the hearts of the people, Batman must defeat his mentor once again so as to bring peace in Gotham.—srijanarora-152-448595After the death of his parents, a rich middle-aged male learns martial arts. He returns to his home city to begin to fight as a vigilante and defend his home city from criminals who want to destroy the city and drive everyone to madness and make them lose their minds.—RECB31 moreAll"
The Wolf of Wall Street,"Based on the true story of Jordan Belfort, from his rise to a wealthy stock-broker living the high life to his fall involving crime, corruption and the federal government.Jordan Belfort (DiCaprio) is Long Island penny stockbroker who serves almost two years in prison for refusing to co-operate in a huge 1990s securities fraud case that involved widespread corruption on Wall Street and in the corporate banking world, including mob infiltration."
Some Like It Hot,"After two male musicians witness a mob hit, they flee the state in an all-female band disguised as women, but further complications set in.After two Chicago musicians, Joe and Jerry, witness the the St. Valentine's Day massacre, they want to get out of town and get away from the gangster responsible, Spats Colombo. They're desperate to get a gig out of town but the only job they know of is in an all-girl band heading to Florida. They show up at the train station as Josephine and Daphne, the replacement saxophone and bass players. They certainly enjoy being around the girls, especially Sugar Kane Kowalczyk who sings and plays the ukulele. Joe in particular sets out to woo her while Jerry/Daphne is wooed by a millionaire, Osgood Fielding III. Mayhem ensues as the two men try to keep their true identities hidden and Spats Colombo and his crew show up for a meeting with several other crime lords.—garykmcdIt's the winter of 1929 in Chicago. Friends and roommates Jerry and Joe are band musicians, a string bassist and tenor saxophonist respectively. They are also deep in debt. Womanizing and smooth talking Joe is a glass half full type of guy, who figures they can earn quick money gambling with what little money they earn to pay off their debts, while more conservative Jerry is a half glass empty type of guy. They are in the wrong place at the wrong time when they witness a gangland slaying by bootlegger Spats Colombo and his men, Jerry and Joe managing to make it away from the scene within an inch of their lives. Needing to lay low and get out of town away from Spats, they sense an opportunity when they learn of a local jazz band needing a bassist and a saxophonist for a three week gig at a luxurious tropical seaside resort in Miami, all expenses paid. The problem?: it's an all girl band, but nothing that ""Geraldine"" and ""Josephine"" can't overcome, the former who instead chooses Daphne as ""her"" stage name. Sweet Sue, the band leader, has two basic rules for the band members while on tour: no liquor and no men. Beyond needing to evade Spats and his henchmen, and maintain the front of being women, especially in the most private of situations with the other female band members, Jerry and Joe have two primary problems. First, the more brazen Joe falls for one of the other band members, ukulele player and vocalist Sugar Kane Kowalczyk, although Jerry too is attracted to her. Joe does whatever he can to find time to get out of drag to woo Sugar while in Miami, using all the knowledge Josephine gleans directly from Sugar about what turns her crank in potential husband material. And second, Jerry, as Daphne, catches the eye of wealthy lovestruck Osgood Fielding III, who won't take no for an answer.—HuggoAfter witnessing a Mafia murder, slick saxophone player Joe and his long-suffering buddy, Jerry, improvise a quick plan to escape from Chicago with their lives. Disguising themselves as women, they join an all-female jazz band and hop a train bound for sunny Florida. While Joe pretends to be a millionaire to win the band's sexy singer, Sugar, Jerry finds himself pursued by a real millionaire as things heat up and the mobsters close in.—Jwelch5742Two struggling musicians witness the St. Valentine's Day Massacre and try to find a way out of the city before they are found and killed by the mob. The only job that will pay their way is an all girl band so the two dress up as women. In addition to hiding, each has his own problems; One falls for another band member but can't tell her his gender, and the other has a rich suitor who will not take ""No,"" for an answer.—John Vogel <jlvogel@comcast.net>1 moreAll"
Green Book,"A working-class Italian-American bouncer becomes the driver for an African-American classical pianist on a tour of venues through the 1960s American South.In 1962, tough bouncer Frank ""Tony Lip"" Vallelonga searches for work while his nightclub is closed for renovations. The most promising offer turns out to be the driver for African-American classical pianist Don Shirley for a concert tour into the Deep South states. Although hardly enthused at working for a Black man, Tony accepts the job and they begin their trek armed with ""The Negro Motorist Green Book,"" a guide for safe travel through America's racial segregation. The snobbishly erudite pianist and the crudely practical bouncer can barely get along with their clashing attitudes to life and ideals. However, as the disparate pair witness and endure America's appalling injustices on the road, they find a newfound respect for each other's talents and start to face them together. In doing so, they nurture an understanding and a friendship that would change both their lives.—Kenneth Chisholm (kchishol@rogers.com)New York City bouncer Frank ""Tony Lip"" Vallelonga is searching for new employment after his nightclub is closed for renovations, eventually landing an interview as a driver for ""Doc"" Don Shirley, a famed pianist. Their first encounter does not go well, as Tony's flippant, uncultured behavior clashes with Don's sophisticated, reserved demeanor. However, Don eventually hires Tony on the strength of others' word, as he needs someone to help him stay out of trouble during an eight-week concert tour through the Deep South. They embark with plans to return home on Christmas Eve. Don's recording studio gives Tony a copy of the ""Green Book"": a guide for Black travelers to find safe havens throughout the segregated South. As they begin the tour in the Midwest, then head further south, Tony and Don clash over their differences; Tony feels uncomfortable being asked to act properly, while Don is disgusted by Tony's habits. Regardless, Tony finds himself impressed with Don's talent on the piano--and increasingly disgusted by the discriminatory treatment the latter receives from the hosts when he is not on stage. After a bar incident leads to a group of white men threatening Don's life, Tony rescues him by threatening to pull a gun on them. He instructs Don not to go out without him for the rest of the tour.Dr. Don Shirley is a world-class African-American pianist who is about to embark on a concert tour in the Deep South in 1962. In need of a driver and protection, Shirley recruits Tony Lip, a tough-talking bouncer from an Italian-American neighborhood in the Bronx. Despite their differences, the two men soon develop an unexpected bond while confronting racism and danger in an era of segregation.—Jwelch5742The Bronx, 1962. In a city divided by segregation, two men from opposite worlds, the elegant and distinguished African-American classical pianist Don Shirley and the tough Italian-American nightclub bouncer Frank ""Tony Lip"" Vallelonga, form an unlikely bond. Their story takes an unexpected turn when the Copacabana Club in New York City shuts down for renovation, and Don, accompanied by his newly hired chauffeur, sets out on an adventurous two-month concert tour in the racially divided Deep South. Armed with his talent, dignity, and a copy of The Negro Motorist Green Book, a guidebook for African-American travellers, Don chooses to take the challenging path for the sake of progress. But are Don's determination and resilience enough to break the barriers of racial discrimination, or will the journey's daunting challenges break his spirit? Can one person make a difference?—Nick Riganas1 moreAll"
The Kid,"The Tramp cares for an abandoned child, but events put their relationship in jeopardy.A woman decides to abandon her baby in the backseat of an automobile with a handwritten note attached, beseeching the finder to care for and love the child. The baby is discovered by the initially-reluctant Tramp, who eventually softens and comes to love him as his own. As the boy grows up, both he and The Tramp must learn to navigate through a life that spawns one adventure after another.—Kyle PerezFaced with raising her fatherless son alone, an unmarried single mother abandons her baby. As one thing leads to another, The Tramp (1915) crosses paths with the child on a street corner, and just like that, the carefree vagabond reluctantly becomes his surrogate father. However, so much can change in five years. Now, the tight-knit pair runs a glazing business, utterly unaware that their already fragile happiness is at stake. But who knows what the future has in store for the bright-eyed kid?—Nick Riganas"
The Father,"A man refuses all assistance from his daughter as he ages. As he tries to make sense of his changing circumstances, he begins to doubt his loved ones, his own mind and even the fabric of his reality.Having scared off his latest caregiver, Anthony, an ailing octogenarian Londoner gradually succumbing to dementia, feels abandoned when his concerned daughter, Anne, tells him she's moving to Paris. Confused and upset, debilitated by his rapid mental decline and warped perspective, Anthony loses his grip on reality as he struggles to navigate the opaque landscape of the present and past. As a result, fading memories and glimpses of lucidity trigger sudden mood swings, distorting Anthony's surroundings, loved ones, and even time. But why has his younger daughter stopped visiting? And who are the strangers that burst in on Anthony?—Nick RiganasA series of vignettes, often building upon themselves, is presented from the perspective of Anthony, an elderly Londoner, in his home. The next in the series often contradicts the previous, leading to the question of what is real and what is in Anthony's mind, possibly of things from his past that are no longer, in the one thing that is certain: that Anthony suffers from Alzheimer's. Those vignettes that are not from his perspective show what is real in his life: that he has an adult daughter Anne and that Anthony has only recently moved in with her and her husband Paul in Anthony driving away the caregivers that Anne had hired for him when he lived on his own. While Anne loves her father, their relationship is often strained in his waning lucidity and the negative effect his constant presence is having on her marriage. Her ability to carry out a life independent of him is compromised if she cannot find further support in care for him. She doesn't want to take the final step of having him placed in a home, but she may have no other alternative if his situation worsens or if her own personal situation, irrespective of him, changes.—Huggo"
Judgment at Nuremberg,"In 1948, an American court in occupied Germany tries four Nazis judged for war crimes.It has been three years since the most important Nazi leaders had already been tried. This trial is about four judges who used their offices to conduct Nazi sterilization and cleansing policies. Retired American judge, Dan Haywood has a daunting task ahead of him. The Cold War is heating up and no one wants any more trials as Germany, and Allied governments, want to forget the past. But is that the right thing to do is the question that the tribunal must decide.—Tony Fontana <tony.fontana@spacebbs.com>It's 1948 in Nuremberg, Germany, where the American military is holding a post-WWII tribunal on the activities of individuals within the Nazi Party leading up to and during the war. Dan Haywood is the lead judge in a three-man judiciary in one of those trials, where four men, who were involved in judicial matters, are the defendants. The general issues surrounding these four is whether they are guilty of international crimes or were just carrying out the laws of their national government, especially as they did not run or operate concentration camps for example, or purportedly know about what was happening to anyone they sentenced to life at those concentration camps. Of the four on trial, the largest question mark surrounds Dr. Ernst Janning, a globally renowned judge. Haywood, not being a well traveled man outside of the US, tries to get to know life in Germany, both then and now, to get a better perspective of the discussions at the trial. He befriends a Mrs. Bertholt as that conduit into German life. The counsel for the prosecution is led by Col. Tad Lawson, who wants to win at any cost, which includes trotting out the emotional aspects of the genocide at the concentration camps at whatever opportunity, regardless of if it actually applies to the defendants. The counsel for the defense is led by Hans Rolfe, who sees the proceedings as German self-determination on trial. Problems on both sides is getting the German public affected to talk about and thus testify about this emotionally traumatizing period of their past. But another issue in the background of this trial is the current Communist aggression, most specifically in Eastern Europe, and the Americans' need for German support in quashing this aggression, support which would be difficult to obtain if the Americans are putting Germans behind bars.—HuggoIn 1947, four German judges who served on the bench during the Nazi regime face a military tribunal to answer charges of crimes against humanity. Chief Justice Haywood hears evidence and testimony not only from lead defendant Ernst Janning and his defense attorney Hans Rolfe, but also from the widow of a Nazi general, an idealistic U.S. Army captain and reluctant witness Irene Wallner.—Jwelch5742"
The Truman Show,"An insurance salesman discovers his whole life is actually a reality TV show.Since birth, a big fat lie defines the well-organised but humdrum life of the kind-hearted insurance salesman and ambitious explorer, Truman Burbank. Utterly unaware of the thousands of cleverly hidden cameras watching his every move, for nearly three decades, Truman's entire existence pivots around the will and the wild imagination of the ruthlessly manipulative television producer, Christof--the all-powerful TV-God of an extreme 24/7 reality show: The Truman Show. As a result, Truman's picturesque neighbourhood with the manicured lawns and the uncannily perfect residents is nothing but an elaborate state-of-the-art set, and the only truth he knows is what the worldwide television network and its deep financial interests dictate. Do lab rats know they are forever imprisoned?—Nick RiganasTruman is a man whose life is a fake one. The place he lives is, in fact, a big studio with hidden cameras everywhere, and all his friends and people around him, are actors who play their roles in the most popular TV-series in the world: The Truman Show. Truman thinks that he is an ordinary man with an ordinary life and has no idea about how he is exploited. Until one day he finds out everything. Will he react?—Chris Makrozahopoulos <makzax@hotmail.com>Truman Burbank is a normal man, living in a normal town. He grew up to be a desk clerk for a insurance company, living an ordinary life, having an ordinary wife, an ordinary neighbour and an ordinary bud, who pops in from time to time with a sixpack. But Truman is not happy with his life. He wants to see the world. He wants to get away from his happy-happy, ever tidy, nice'n'shiny little island town at the seaside. In reality, Truman was an unwanted pregnancy. His ""father"", Christof, a reckless TV-Producer whom he never met, made up the Truman Show - the greatest show on earth - a show in which life is live. So, everyone around poor Truman is an actor with a little headphone in the ear. One day, Truman accidentally bumps into a catering area backstage and gets pretty suspicious. His plan now is: Pretend to be sleeping and steal away...—Julian Reischl <julianreischl@mac.com>Truman Burbankis happy with his life. He is a successful business man, he has a nice wife and many friends. However, Truman finds his life is getting very repetitive. Actually every moment of his life is being filmed, being watched by millions, and that his world is limited in a small Hollywood film set. Truman decides to follow his discovery no matter how hard and how much it pains him.—Christian1 moreAll"
